id,objeto,entidade_adj,adjudicataria,adj_nif,tipo_contrato,tipo_proc,preco,preco_efetivo,data_pub,data_contrato,cpv,distrito,ano,ajuste_direto,score_risco,nivel_risco,flags,fonte_ano,atualizado
191605,RFN - MANUTENÇÃO TELEMÁTICA 1ª LINHA LOTE 1 CT3 2024,503933813 - Infraestruturas de Portugal,"502533447 - Efacec Engenharia e Sistemas, S.A.",,Aquisição de serviços,Ajuste Direto Regime Geral,160885.34,228297.42,2024-10-24,2024-10-17,50225000-8 - Serviços de manutenção de vias férreas,,2024,1,60.0,alto,"[""ajuste direto"", ""valor elevado (160,885€)"", ""desvio preço 42%"", ""adjudicações repetidas (27x)""]",2024,2026-04-02T01:34:00.894116
214322,Fornecimento de refeições confeccionadas para as unidades orgânicas da Delegação Regional do Norte e da Delegação Regional do Centro para o período de 2 meses.,"501442600 - Instituto do Emprego e da Formação Profissional, I. P.",500347506 - Eurest Portugal Lda,,Aquisição de serviços,Ajuste Direto Regime Geral,466496.84,315324.31,2025-01-06,2024-12-30,55510000-8 - Serviços de cantinas,,2024,1,60.0,alto,"[""ajuste direto"", ""valor elevado (466,497€)"", ""desvio preço 32%"", ""adjudicações repetidas (202x)""]",2024,2026-04-02T01:34:06.122674
229378,92/0712/2022 - Aquisição de Próteses e Revisão da Anca Cimentada e Não Cimentada,"510745997 - Centro Hospitalar Universitário do Algarve, E. P. E.",500153370 - JOHNSON &amp; JOHNSON,,Aquisição de bens móveis,Ajuste Direto Regime Geral,83545.0,53805.0,2022-02-04,2022-01-20,33140000-3 - Material médico de consumo,Faro,2022,1,60.0,alto,"[""ajuste direto"", ""valor elevado (83,545€)"", ""desvio preço 36%"", ""adjudicações repetidas (24x)""]",2022,2026-04-02T01:34:09.225528
229542,Serviços de desenvolvimento de solução para gestão de atribuição da tarifa social,502017368 - Autoridade Nacional de Comunicações,"503541320 - GLINTT - Global Intelligent Technologies, S.A.",,Aquisição de serviços,Ajuste Direto Regime Geral,78380.0,115580.0,2022-02-02,2022-01-31,"72000000-5 - Serviços de TI: consultoria, desenvolvimento de software, Internet e apoio",Lisboa,2022,1,60.0,alto,"[""ajuste direto"", ""valor elevado (78,380€)"", ""desvio preço 47%"", ""adjudicações repetidas (30x)""]",2022,2026-04-02T01:34:09.246625
232015,Empreitada de Pavimentação Betuminosa na Zona Junto ao Porto das Cinco Ribeiras,512044040 - Município de Angra do Heroísmo,"512047235 - Tecnovia Açores, Sociedade de Empreitadas, S.A.",,Empreitadas de obras públicas,Ajuste Direto Regime Geral,99985.52,10111605.0,2022-02-17,2022-02-16,45233200-1 - Obras diversas de pavimentação,Região Autónoma dos Açores,2022,1,60.0,alto,"[""ajuste direto"", ""valor elevado (99,986€)"", ""desvio preço 10013%"", ""adjudicações repetidas (82x)""]",2022,2026-04-02T01:34:10.183992
232272,"ADCC 005/2022 - AJUSTE DIRETO COM CONVITE A UMA ENTIDADE, COM VISTA AO FORNECIMENTO DE ELETRICIDADE",680047360 - Serviços de Ação Social da Universidade do Minho,"500697370 - PETROGAL, S.A.",,Aquisição de bens móveis,Ajuste Direto Regime Geral,373854.14,249653.41,2022-02-16,2022-02-10,09310000-5 - Electricidade,Braga,2022,1,60.0,alto,"[""ajuste direto"", ""valor elevado (373,854€)"", ""desvio preço 33%"", ""adjudicações repetidas (513x)""]",2022,2026-04-02T01:34:10.242122
235839,"Aquisição de serviço postal universal, por um único prestador em todo o território nacional, para o IMT, I.P. – de 01 de março a 31 de dezembro de 2022.","508195446 - Instituto da Mobilidade e dos Transportes, I. P.","500077568 - CTT - Correios de Portugal, S.A.",,Aquisição de serviços,Ajuste Direto Regime Geral,300000.0,205414.62,2022-03-07,2022-02-28,64121100-1 - Serviços de distribuição de correio,,2022,1,60.0,alto,"[""ajuste direto"", ""valor elevado (300,000€)"", ""desvio preço 32%"", ""adjudicações repetidas (159x)""]",2022,2026-04-02T01:34:10.898536
242075,Aquisição de Serviços de Segurança e Vigilância Humana para suprir necessidades no âmbito do contexto epidemiológico da doença respiratória aguda por novo coronavírus (nCOV-2019) nos Serviços Centrais; ACeS Entre o Douro e Vouga II - Aveiro Norte; ACeS Grande Porto VIII - Espinho/Gaia; ACeS Trás-os-Montes - Alto Tâmega e Barroso; ACeS Cávado III - Barcelos/Esposende; ACeS Entre o Douro e Vouga I - Feira/Arouca; ACeS Cávado II - Gerês/Cabreira; ACeS Grande Porto II - Gondomar; ACeS Grande Porto III - Maia/Valongo; ACeS Douro I - Marão e Douro Norte; ACeS Grande Porto I - Santo Tirso/Trofa; ACeS Tâmega II - Vale Sousa Sul e ACeS Tâmega III - Vale Sousa Norte.,"503135593 - Administração Regional de Saúde do Norte, I. P.","507011724 - Ronsegur, Rondas e Segurança, S.A.",,Aquisição de serviços,Ajuste Direto Regime Geral,422022.25,113093.8,2022-03-29,2022-01-27,79714000-2 - Serviços de vigilância,Distrito não determinado,2022,1,60.0,alto,"[""ajuste direto"", ""valor elevado (422,022€)"", ""desvio preço 73%"", ""adjudicações repetidas (16x)""]",2022,2026-04-02T01:34:12.534742
243428,Fornecimento de Gás Natural a instalações Municipais,505776758 - Município da Marinha Grande,"503504564 - EDP COMERCIAL-COMERCIALIZAÇÃO DE ENERGIA, S.A.",,Aquisição de bens móveis,Ajuste Direto Regime Geral,106943.5,70938.97,2022-04-04,2022-04-01,09123000-7 - Gás natural,,2022,1,60.0,alto,"[""ajuste direto"", ""valor elevado (106,944€)"", ""desvio preço 34%"", ""adjudicações repetidas (21x)""]",2022,2026-04-02T01:34:12.839176
249373,"040210922022 - 24º MCC BATAS CAMPOS COBERTURAS TROUXAS PACKS E BOLSAS
* BATA CIRUR REFORC  ZONA FRONTAL/MANGA/COTOVELO XL
* BOLSA COLECTORA  FLUIDOS 102X112CM T/P89415
* CAMPO ADESIVO TRANSP 1 BOLSA
* COBERTURA P/ISOLAMENTO AMPLIFICADOR MESA OPERAT 110X180CM
* COBERTURA P/TUBOS LAPAROSC 12X240CM
* PACK ANCA,COLUNA e PACK PE
* PACK CAMPO EM U
* PACK EXTREMIDADES
* PACK ISOLAMENTO VERTICAL 
* TROUXA LAPAROSCOPIA P/CIRURG ABDOMINAL/PERINEAL
* TROUXA CIRUR C/CAMPO ISOLAMENTO VERTICAL 25X86CM
* TROUXA CIRUR CRANIOTOMIA
* TROUXA CIRUR LAPAROSC
* TROUXA CIRUR PARTO C/PERNEIRA
* TROUXA ESTERIL P/UROLOGIA RTU","510103448 - Centro Hospitalar e Universitário de Coimbra, E. P. E.",511101066 - Molnlycke Health Care,,Aquisição de bens móveis,Ajuste Direto Regime Geral,157897.94,98893.31,2022-04-29,2022-04-27,"33000000-0 - Equipamento médico, medicamentos e produtos para cuidados pessoais",Coimbra,2022,1,60.0,alto,"[""ajuste direto"", ""valor elevado (157,898€)"", ""desvio preço 37%"", ""adjudicações repetidas (77x)""]",2022,2026-04-02T01:34:14.048734
249567,CABOZANTINIB 60 MG COMP,"511228848 - Serviço de Saúde da Região Autónoma da Madeira, EPERAM (SESARAM, EPERAM)","502609800 - Ipsen Portugal, Lab. Farm. S. A.",,Aquisição de bens móveis,Ajuste Direto Regime Geral,90999.95,24499.99,2022-05-02,2022-03-15,33690000-3 - Medicamentos vários,Região Autónoma da Madeira,2022,1,60.0,alto,"[""ajuste direto"", ""valor elevado (91,000€)"", ""desvio preço 73%"", ""adjudicações repetidas (27x)""]",2022,2026-04-02T01:34:14.073325
250523,Fornecimento de Energia em Baixa Tensão Normal,502834846 - Município do Montijo,"500697370 - PETROGAL, S.A.",,Aquisição de serviços,Ajuste Direto Regime Geral,380000.0,226684.52,2022-05-05,2022-04-19,71314100-3 - Serviços de electricidade,Setúbal,2022,1,60.0,alto,"[""ajuste direto"", ""valor elevado (380,000€)"", ""desvio preço 40%"", ""adjudicações repetidas (513x)""]",2022,2026-04-02T01:34:14.642983
250606,Fornecimento de Gás Natural,506321894 - Município de Olhão,"503504564 - EDP Comercial - Comercialização de Energia, S.A.",,Aquisição de bens móveis,Ajuste Direto Regime Geral,80000.0,26409.83,2022-05-05,2022-05-02,09123000-7 - Gás natural,Faro,2022,1,60.0,alto,"[""ajuste direto"", ""valor elevado (80,000€)"", ""desvio preço 67%"", ""adjudicações repetidas (259x)""]",2022,2026-04-02T01:34:14.665957
251804,NONACOG,"511228848 - Serviço de Saúde da Região Autónoma da Madeira, EPERAM (SESARAM, EPERAM)",500162166 - LABORATORIOS PFIZER  LDA,,Aquisição de bens móveis,Ajuste Direto Regime Geral,373120.0,237864.0,2022-05-10,2022-02-10,33690000-3 - Medicamentos vários,Região Autónoma da Madeira,2022,1,60.0,alto,"[""ajuste direto"", ""valor elevado (373,120€)"", ""desvio preço 36%"", ""adjudicações repetidas (24x)""]",2022,2026-04-02T01:34:14.922358
252272,040114722022 - MOGAMULIZUMAB 20 MG/5 ML SOL INJ FR 5 ML IV,"510103448 - Centro Hospitalar e Universitário de Coimbra, E. P. E.","514194880 - Kyowa Kirin Farmacêutica, Unipessoal Lda",,Aquisição de bens móveis,Ajuste Direto Regime Geral,121000.0,17600.0,2022-05-09,2022-05-03,33600000-6 - Produtos farmacêuticos,Coimbra,2022,1,60.0,alto,"[""ajuste direto"", ""valor elevado (121,000€)"", ""desvio preço 85%"", ""adjudicações repetidas (15x)""]",2022,2026-04-02T01:34:15.024118
255360,"EXCL ROCHE FARMACEUTICA QUIMICA, LDA - POLATUZUMAB 140MG, INJ IV*","506361438 - Instituto Português de Oncologia de Coimbra Francisco Gentil, E. P. E.","500233810 - ROCHE FARMACÊUTICA QUIMICA, LDA.",,Aquisição de bens móveis,Ajuste Direto Regime Geral,177105.6,67937.31,2022-05-23,2022-01-17,33600000-6 - Produtos farmacêuticos,Coimbra,2022,1,60.0,alto,"[""ajuste direto"", ""valor elevado (177,106€)"", ""desvio preço 62%"", ""adjudicações repetidas (1057x)""]",2022,2026-04-02T01:34:15.645122
255953,EXCL TAKEDA-FARMACEUTICOS PORTUGAL LDA - BRIGATINIB,"506361438 - Instituto Português de Oncologia de Coimbra Francisco Gentil, E. P. E.","502801204 - Takeda - Farmacêutica Portugal, Lda",,Aquisição de bens móveis,Ajuste Direto Regime Geral,238355.32,81271.7,2022-05-24,2022-01-18,33600000-6 - Produtos farmacêuticos,Coimbra,2022,1,60.0,alto,"[""ajuste direto"", ""valor elevado (238,355€)"", ""desvio preço 66%"", ""adjudicações repetidas (38x)""]",2022,2026-04-02T01:34:15.802657
258017,"Fornecimento de Efmoroctocog alfa ao HSEIT, EPER","512105030 - Hospital de Santo Espírito da Ilha Terceira, E. P. E. R.",500223238 - PROFARIN DISTRIBUIDORA DE PROD. FARM. INDUSTRIAIS,,Aquisição de bens móveis,Ajuste Direto Regime Geral,234214.08,53674.1,2022-06-01,2022-05-18,"33000000-0 - Equipamento médico, medicamentos e produtos para cuidados pessoais",Região Autónoma dos Açores,2022,1,60.0,alto,"[""ajuste direto"", ""valor elevado (234,214€)"", ""desvio preço 77%"", ""adjudicações repetidas (262x)""]",2022,2026-04-02T01:34:16.200199
258656,SOLUÇÕES DE HEMODIÁLISE,"511228848 - Serviço de Saúde da Região Autónoma da Madeira, EPERAM (SESARAM, EPERAM)","503070220 - Fresenius Medical Care, Lda",,Aquisição de bens móveis,Ajuste Direto Regime Geral,81600.0,47520.0,2022-05-31,2022-04-27,33190000-8 - Dispositivos e produtos médicos variados,Região Autónoma da Madeira,2022,1,60.0,alto,"[""ajuste direto"", ""valor elevado (81,600€)"", ""desvio preço 42%"", ""adjudicações repetidas (32x)""]",2022,2026-04-02T01:34:16.327961
258749,"Aquisição de Serviço Postal Universal a Crédito para a Secretaria Regional de Economia: Gabinete do Secretário Regional (GAB), Centro de Arbitragem de Conflitos de Consumo da RAM (CACCRAM), Autoridade Regional das Atividades Económicas (ARAE) e Direção Regional de Economia e Transportes Terrestres (DRETT)",600087379 - Secretaria Regional de Economia,"500077568 - CTT - Correios de Portugal, S.A.",,Aquisição de serviços,Ajuste Direto Regime Geral,266500.0,60725.14,2022-06-03,2022-05-17,64000000-6 - Serviços postais e de telecomunicações,Região Autónoma da Madeira,2022,1,60.0,alto,"[""ajuste direto"", ""valor elevado (266,500€)"", ""desvio preço 77%"", ""adjudicações repetidas (159x)""]",2022,2026-04-02T01:34:16.341053
260702,EXCL ZENTIVA - BEVACIZUMAB 100 MG  INJ IV E  BEVACIZUMAB 400 MG INJ IV,"506361438 - Instituto Português de Oncologia de Coimbra Francisco Gentil, E. P. E.","503103551 - ZENTIVA PORTUGAL, LDA",,Aquisição de bens móveis,Ajuste Direto Regime Geral,116982.0,69915.2,2022-06-15,2022-01-03,33600000-6 - Produtos farmacêuticos,Coimbra,2022,1,60.0,alto,"[""ajuste direto"", ""valor elevado (116,982€)"", ""desvio preço 40%"", ""adjudicações repetidas (438x)""]",2022,2026-04-02T01:34:17.093905
262806,Fornecimento de energia em Baixa Tensão Normal,502834846 - Município do Montijo,"500697370 - Petrogal, S.A.",,Aquisição de serviços,Ajuste Direto Regime Geral,368614.0,182136.14,2022-06-20,2022-06-09,71314100-3 - Serviços de electricidade,Setúbal,2022,1,60.0,alto,"[""ajuste direto"", ""valor elevado (368,614€)"", ""desvio preço 51%"", ""adjudicações repetidas (729x)""]",2022,2026-04-02T01:34:17.655565
263704,"Fornecimento de Aflibercept intravítreo ao HSEIT, EPER","512105030 - HOSPITAL DE SANTO ESPÍRITO DA ILHA TERCEIRA, EPER","500043256 - BAYER PORTUGAL, SA.",,Aquisição de bens móveis,Ajuste Direto Regime Geral,81685.44,35170.12,2022-07-01,2022-06-01,"33000000-0 - Equipamento médico, medicamentos e produtos para cuidados pessoais",Região Autónoma dos Açores,2022,1,60.0,alto,"[""ajuste direto"", ""valor elevado (81,685€)"", ""desvio preço 57%"", ""adjudicações repetidas (674x)""]",2022,2026-04-02T01:34:17.913583
263871,"PRESTAÇÃO DE SERVIÇOS DE RECOLHA E TRANSPORTE A DESTINO FINAL E RESÍDUOS SÓLIDOS URBANOS, FORNECIMENTO, COLOCAÇÃO, LAVAGEM E MANUTENÇÃO DE CONTENTORES NO CONCELHO DE VILA POUCA DE AGUIAR",506810267 - Município de Vila Pouca de Aguiar,"502877472 - Ecoambiente - Serviços e Meio Ambiente, S.A.",,Aquisição de serviços,Ajuste Direto Regime Geral,138000.0,46000.0,2022-01-10,2022-01-10,90511100-3 - Serviços de recolha de resíduos sólidos urbanos,Vila Real,2022,1,60.0,alto,"[""ajuste direto"", ""valor elevado (138,000€)"", ""desvio preço 67%"", ""adjudicações repetidas (12x)""]",2022,2026-04-02T01:34:17.960705
264604,"Fornecimento de Raltegravir, Sugamadex e Golimumab ao HSEIT, EPER","512105030 - HOSPITAL DE SANTO ESPÍRITO DA ILHA TERCEIRA, EPER","500191360 - Merck Sharp &amp; Dohme, Lda.",,Aquisição de bens móveis,Ajuste Direto Regime Geral,405913.01,177259.1,2022-07-06,2022-07-01,"33000000-0 - Equipamento médico, medicamentos e produtos para cuidados pessoais",Região Autónoma dos Açores,2022,1,60.0,alto,"[""ajuste direto"", ""valor elevado (405,913€)"", ""desvio preço 56%"", ""adjudicações repetidas (173x)""]",2022,2026-04-02T01:34:18.122094
264668,"Fornecimento de Ipilimumab e Nivolumab ao HSEIT, EPER","512105030 - HOSPITAL DE SANTO ESPÍRITO DA ILHA TERCEIRA, EPER",500048193 - BRISTOL - MYERS SQUIBB SA.,,Aquisição de bens móveis,Ajuste Direto Regime Geral,377168.52,214455.25,2022-07-06,2022-07-01,"33000000-0 - Equipamento médico, medicamentos e produtos para cuidados pessoais",Região Autónoma dos Açores,2022,1,60.0,alto,"[""ajuste direto"", ""valor elevado (377,169€)"", ""desvio preço 43%"", ""adjudicações repetidas (342x)""]",2022,2026-04-02T01:34:18.132090
266666,PRESTAÇÃO DE SERVIÇOS NA ÁREA DOS SEGUROS,505931192 - Município de Aveiro,"500940231 - GENERALI SEGUROS, S.A.",,Aquisição de serviços,Ajuste Direto Regime Geral,259893.33,353463.12,2022-07-07,2022-07-01,66510000-8 - Serviços de seguros,Aveiro,2022,1,60.0,alto,"[""ajuste direto"", ""valor elevado (259,893€)"", ""desvio preço 36%"", ""adjudicações repetidas (72x)""]",2022,2026-04-02T01:34:18.558554
267367,"Fornecimento de Fumarato de Dimetilo, Interferão Beta-1a e Natalizumab ao HSEIT, EPER","512105030 - HOSPITAL DE SANTO ESPÍRITO DA ILHA TERCEIRA, EPER","506415740 - BIOGEN IDEC PORTUGAL, LDA",,Aquisição de bens móveis,Ajuste Direto Regime Geral,288053.51,106617.2,2022-07-08,2022-07-01,"33000000-0 - Equipamento médico, medicamentos e produtos para cuidados pessoais",Região Autónoma dos Açores,2022,1,60.0,alto,"[""ajuste direto"", ""valor elevado (288,054€)"", ""desvio preço 63%"", ""adjudicações repetidas (35x)""]",2022,2026-04-02T01:34:18.686798
268102,"Fornecimento de Dupilumab e Teriflunomida ao HSEIT, EPER","512105030 - HOSPITAL DE SANTO ESPÍRITO DA ILHA TERCEIRA, EPER","500134960 - SANOFI- PRODUTOS FARMACÊUTICOS,LDA.",,Aquisição de bens móveis,Ajuste Direto Regime Geral,93232.22,46131.66,2022-07-20,2022-06-01,"33000000-0 - Equipamento médico, medicamentos e produtos para cuidados pessoais",Região Autónoma dos Açores,2022,1,60.0,alto,"[""ajuste direto"", ""valor elevado (93,232€)"", ""desvio preço 51%"", ""adjudicações repetidas (920x)""]",2022,2026-04-02T01:34:18.805506
268399,"Fornecimento de Atezolizumab, Pirfenidona, Vemurafenib, Cobimetinib e Alectinib ao HSEIT, EPER","512105030 - HOSPITAL DE SANTO ESPÍRITO DA ILHA TERCEIRA, EPER","500233810 - ROCHE FARMACÊUTICA QUIMICA, LDA.",,Aquisição de bens móveis,Ajuste Direto Regime Geral,323324.26,97557.57,2022-07-21,2022-07-04,"33000000-0 - Equipamento médico, medicamentos e produtos para cuidados pessoais",Região Autónoma dos Açores,2022,1,60.0,alto,"[""ajuste direto"", ""valor elevado (323,324€)"", ""desvio preço 70%"", ""adjudicações repetidas (1057x)""]",2022,2026-04-02T01:34:18.847997
271134,AL B) EXCL PFIZER - VÁRIOS,"506361438 - Instituto Português de Oncologia de Coimbra Francisco Gentil, E. P. E.","500162166 - LAB. PFIZER, LDA.",,Aquisição de bens móveis,Ajuste Direto Regime Geral,123558.8,78105.34,2022-07-26,2022-07-15,33600000-6 - Produtos farmacêuticos,Coimbra,2022,1,60.0,alto,"[""ajuste direto"", ""valor elevado (123,559€)"", ""desvio preço 37%"", ""adjudicações repetidas (1676x)""]",2022,2026-04-02T01:34:19.768888
278015,EXCL GILEAD SCIENCES - SACITUZUMAB GOVITECANO 200 MG,"506361438 - Instituto Português de Oncologia de Coimbra Francisco Gentil, E. P. E.",503604704 - GILEAD SCIENCES LDA.,,Aquisição de bens móveis,Ajuste Direto Regime Geral,193500.0,75250.0,2022-09-07,2022-08-12,33600000-6 - Produtos farmacêuticos,Coimbra,2022,1,60.0,alto,"[""ajuste direto"", ""valor elevado (193,500€)"", ""desvio preço 61%"", ""adjudicações repetidas (564x)""]",2022,2026-04-02T01:34:21.224414
278512,040100942022-MEDICAMENTOS PARA A MÁQUINA DE REEMBALAGEM PROUD,"510103448 - Centro Hospitalar e Universitário de Coimbra, E. P. E.","507981227 - KRKA FARMACÊUTICA, SOCIEDADE UNIPESSOAL LDA.",,Aquisição de bens móveis,Ajuste Direto Regime Geral,169200.0,108922.5,2022-09-08,2022-03-14,33698000-9 - Produtos para fins clínicos,Coimbra,2022,1,60.0,alto,"[""ajuste direto"", ""valor elevado (169,200€)"", ""desvio preço 36%"", ""adjudicações repetidas (12x)""]",2022,2026-04-02T01:34:21.309773
285830,"Fornecimento de energia elétrica para as instalações dos Serviços Municipalizados de Água e Saneamento de Mafra, relativa aos meses de janeiro e fevereiro de 2022",600087247 - Serviços Municipalizados de Águas e Saneamento de Mafra - SMAS de Mafra,"500697370 -  Petrogal, S.A.",,Aquisição de serviços,Ajuste Direto Regime Geral,208538.65,20746479.0,2022-10-07,2022-02-15,65310000-9 - Distribuição de electricidade,Lisboa,2022,1,60.0,alto,"[""ajuste direto"", ""valor elevado (208,539€)"", ""desvio preço 9849%"", ""adjudicações repetidas (577x)""]",2022,2026-04-02T01:34:23.480031
287458,"Prestação de Serviços Médicos nos ACES, para o mês de julho de 2022","503148709 - Administração Regional de Saúde do Algarve, I. P.","510723691 - Kelly Services Healthcare, Unipessoal, Lda",,Aquisição de serviços,Ajuste Direto Regime Geral,86005.7,50927.6,2022-10-13,2022-07-21,85141000-9 - Serviços prestados pelo pessoal médico,Faro,2022,1,60.0,alto,"[""ajuste direto"", ""valor elevado (86,006€)"", ""desvio preço 41%"", ""adjudicações repetidas (16x)""]",2022,2026-04-02T01:34:23.760564
289516,AD 101/2022 - Aquisição de eletricidade em baixa tensão especial (BTE) II,"505322730 - EMARP - Empresa Municipal de Águas e Resíduos de Portimão, EM, SA","513172670 - Luzboa - Comercialização de Energia, Lda",,Aquisição de bens móveis,Ajuste Direto Regime Geral,104999.82,60517.38,2022-10-31,2022-10-20,09310000-5 - Electricidade,Faro,2022,1,60.0,alto,"[""ajuste direto"", ""valor elevado (105,000€)"", ""desvio preço 42%"", ""adjudicações repetidas (14x)""]",2022,2026-04-02T01:34:24.105597
290157,Aquisição de gás natural para restantes meses de 2022,600008878 - Guarda Nacional Republicana,"- - PETROGAL, S.A.",,Aquisição de bens móveis,Ajuste Direto Regime Geral,199391.24,135381.97,2022-11-03,2022-11-03,09123000-7 - Gás natural,Lisboa,2022,1,60.0,alto,"[""ajuste direto"", ""valor elevado (199,391€)"", ""desvio preço 32%"", ""adjudicações repetidas (99x)""]",2022,2026-04-02T01:34:24.612015
290978,"Empreitada de Requalificação da Unidade de Saúde da ilha do Corvo, Açores",600087077 - Direção Regional das Obras Públicas e Transportes Terrestres,"510866123 - TREPA Construção Civil, Lda",,Empreitadas de obras públicas,Ajuste Direto Regime Geral,369700.0,494326.21,2022-11-08,2022-11-05,45200000-9 - Obras de construção total ou parcial e de engenharia civil,Região Autónoma dos Açores,2022,1,60.0,alto,"[""ajuste direto"", ""valor elevado (369,700€)"", ""desvio preço 34%"", ""adjudicações repetidas (21x)""]",2022,2026-04-02T01:34:24.864077
291952,"Em virtude de haver apenas uma concessionária de transportes públicos regulares de passageiros automóveis pesados, para zona urbana do Funchal.",671000381 - Escola Básica e Secundária Gonçalves Zarco,"511026340 - Horários do Funchal - Transportes Públicos, S. A.",,Aquisição de serviços,Ajuste Direto Regime Geral,82492.86,41702.32,2022-11-11,2022-08-01,60112000-6 - Serviços de transporte público rodoviário,Região Autónoma da Madeira,2022,1,60.0,alto,"[""ajuste direto"", ""valor elevado (82,493€)"", ""desvio preço 49%"", ""adjudicações repetidas (12x)""]",2022,2026-04-02T01:34:25.076357
292038,"Aquisição de Lanches - Atividades de Animação e de Apoio à Família na Educação Pré-Escolar e Componente de Apoio à Família no 1.º Ciclo do Ensino Básico, durante o ano letivo de 2022/23",501138960 - Município de Valongo,"500126623 - GERTAL - Companhia Geral de Restaurantes e Alimentação, S.A.",,Aquisição de serviços,Ajuste Direto Regime Geral,172500.0,116372.03,2022-11-04,2022-10-31,55524000-9 - Serviços de fornecimento de refeições (catering) a escolas,Porto,2022,1,60.0,alto,"[""ajuste direto"", ""valor elevado (172,500€)"", ""desvio preço 33%"", ""adjudicações repetidas (27x)""]",2022,2026-04-02T01:34:25.107771
296308,"040133782022 - LUTÉCIO (177LU) DOTATATE 7,4 GBQ","510103448 - Centro Hospitalar e Universitário de Coimbra, E. P. E.",500063524 - NOVARTIS FARMACEUTICA,,Aquisição de bens móveis,Ajuste Direto Regime Geral,167166.0,92870.0,2022-12-02,2022-11-23,33600000-6 - Produtos farmacêuticos,Coimbra,2022,1,60.0,alto,"[""ajuste direto"", ""valor elevado (167,166€)"", ""desvio preço 44%"", ""adjudicações repetidas (98x)""]",2022,2026-04-02T01:34:26.066821
298499,"Fornecimento de Gás Natural, baixa pressão, para o Instituto Politécnico da Guarda, para os meses de novembro e dezembro de 2022",600023265 - Instituto Politécnico da Guarda,"500697370 - Petrogal, S.A.",,Aquisição de bens móveis,Ajuste Direto Regime Geral,300000.0,208386.18,2022-12-13,2022-12-12,"09000000-3 - Produtos petrolíferos, combustíveis, electricidade e outras fontes de energia",Guarda,2022,1,60.0,alto,"[""ajuste direto"", ""valor elevado (300,000€)"", ""desvio preço 31%"", ""adjudicações repetidas (729x)""]",2022,2026-04-02T01:34:26.453534
300460,L. CASCAIS - FISCALIZAÇÃO E CSO 2022,503933813 - Infraestruturas de Portugal,"503231100 - Afaplan - Planeamento e Gestão de Projectos, S.A.",,Aquisição de serviços,Ajuste Direto Regime Geral,236432.53,114339.75,2022-12-20,2022-12-16,71540000-5 - Serviços de gestão de obras,,2022,1,60.0,alto,"[""ajuste direto"", ""valor elevado (236,433€)"", ""desvio preço 52%"", ""adjudicações repetidas (46x)""]",2022,2026-04-02T01:34:27.305957
303797,AM 44/2023 -  Prestação de Serviços Médicos para os ACES - jan e fev. de 2023,"503148709 - Administração Regional de Saúde do Algarve, I. P.","513993274 - Precise, SA",,Aquisição de serviços,Ajuste Direto Regime Geral,193779.68,109408.5,2022-12-21,2022-12-21,85121100-4 - Serviços de médicos de clínica geral,Faro,2022,1,60.0,alto,"[""ajuste direto"", ""valor elevado (193,780€)"", ""desvio preço 44%"", ""adjudicações repetidas (19x)""]",2022,2026-04-02T01:34:28.234066
305531,Aquisição de Serviços de Limpeza para as instalações da GNR para a Primeira Quinzena de 2023,600008878 - Guarda Nacional Republicana,"509418627 - Fine Facility Services, Lda",,Aquisição de serviços,Ajuste Direto Regime Geral,320380.87,219223.62,2023-01-17,2022-12-30,"90911000-6 - Serviços de limpeza de alojamentos, edifícios e janelas",Lisboa,2022,1,60.0,alto,"[""ajuste direto"", ""valor elevado (320,381€)"", ""desvio preço 32%"", ""adjudicações repetidas (274x)""]",2022,2026-04-02T01:34:28.614493
312001,4590008/2022 FORN ELECTRICIDADE MESES SETEMBRO E OUTUBRO (ENQUANTO AGUARDA CONCLUSÃO DO PROC SPMS),"509186998 - Centro Hospitalar Barreiro Montijo, E. P. E.","500697370 - PETROGAL, S.A.",,Aquisição de bens móveis,Ajuste Direto Regime Geral,363415.0,505049.83,2023-03-29,2022-10-12,09310000-5 - Electricidade,Setúbal,2022,1,60.0,alto,"[""ajuste direto"", ""valor elevado (363,415€)"", ""desvio preço 39%"", ""adjudicações repetidas (513x)""]",2022,2026-04-02T01:34:30.249704
312070,040100232023-NONACOG BETA PEGOL  PÓ SOL INJ FR IV,"510103448 - Centro Hospitalar e Universitário de Coimbra, E.P.","501485210 - NOVO NORDISK, LDA",,Aquisição de bens móveis,Ajuste Direto Regime Geral,468077.52,684780.12,2023-03-31,2022-12-27,33600000-6 - Produtos farmacêuticos,Coimbra,2022,1,60.0,alto,"[""ajuste direto"", ""valor elevado (468,078€)"", ""desvio preço 46%"", ""adjudicações repetidas (46x)""]",2022,2026-04-02T01:34:30.266315
