id,objeto,entidade_adj,adjudicataria,adj_nif,tipo_contrato,tipo_proc,preco,preco_efetivo,data_pub,data_contrato,cpv,distrito,ano,ajuste_direto,score_risco,nivel_risco,flags,fonte_ano,atualizado
316824,NPD-3022000848-AMN - Serviços de Limpeza nas Unidades Apoiadas pela DGAM (UMC),600012662 - DGAM,"502611057 - Interlimpe - Facility services, SA",,Aquisição de serviços,Ajuste Direto Regime Geral,377847.12,237932.23,2022-02-01,2022-02-01,90910000-9 - Serviços de limpeza,,2022,1,60.0,alto,"[""ajuste direto"", ""valor elevado (377,847€)"", ""desvio preço 37%"", ""adjudicações repetidas (363x)""]",2022,2026-04-02T01:34:31.364481
317027,OCTOCOG ALFA 1500 U.I. PÓ SOL INJ FR IV,"510103448 - Centro Hospitalar e Universitário de Coimbra, E. P. E.","502801204 - Takeda - Farmacêuticos Portugal, Lda.",,Aquisição de bens móveis,Ajuste Direto Regime Geral,463500.0,278872.5,2022-02-01,2022-01-24,33600000-6 - Produtos farmacêuticos,Coimbra,2022,1,60.0,alto,"[""ajuste direto"", ""valor elevado (463,500€)"", ""desvio preço 40%"", ""adjudicações repetidas (53x)""]",2022,2026-04-02T01:34:31.401937
319510,Aquisição de vestuário profissional,506803228 - ATEC - Associação de Formação Para a Indústria,"505766205 - HR Protecção, SA",,Aquisição de bens móveis,Ajuste Direto Regime Geral,198959.38,138940.33,2022-02-15,2022-02-15,18110000-3 - Vestuário profissional,Setúbal,2022,1,60.0,alto,"[""ajuste direto"", ""valor elevado (198,959€)"", ""desvio preço 30%"", ""adjudicações repetidas (77x)""]",2022,2026-04-02T01:34:31.843347
321731,3001/22/0000032 - Aquisição de serviços postais,"504322915 - Instituto de Informática, I. P.","500077568 - CTT - Correios de Portugal, S.A.",,Aquisição de serviços,Ajuste Direto Regime Geral,146220.0,208380.77,2022-02-23,2022-02-16,64110000-0 - Serviços postais,Lisboa,2022,1,60.0,alto,"[""ajuste direto"", ""valor elevado (146,220€)"", ""desvio preço 43%"", ""adjudicações repetidas (159x)""]",2022,2026-04-02T01:34:32.811553
321951,IMATINIB COMPRIMIDOS,"510103448 - Centro Hospitalar e Universitário de Coimbra, E. P. E.","501505334 - FARMOZ, LDA",,Aquisição de bens móveis,Ajuste Direto Regime Geral,270900.0,27810.0,2022-02-24,2022-02-09,33600000-6 - Produtos farmacêuticos,Coimbra,2022,1,60.0,alto,"[""ajuste direto"", ""valor elevado (270,900€)"", ""desvio preço 90%"", ""adjudicações repetidas (42x)""]",2022,2026-04-02T01:34:32.871788
322742,AD004.GSI.2021 – Aquisição de Serviços de Telecomunicações,"507396081 - EMAC - Empresa Municipal de Ambiente de Cascais, E. M., S. A.","502544180 - Vodafone Portugal - Comunicações Pessoais, S.A.",,Aquisição de serviços,Ajuste Direto Regime Geral,390000.0,223574.26,2022-02-28,2022-02-24,64200000-8 - Serviços de telecomunicações,Lisboa,2022,1,60.0,alto,"[""ajuste direto"", ""valor elevado (390,000€)"", ""desvio preço 43%"", ""adjudicações repetidas (159x)""]",2022,2026-04-02T01:34:33.080902
329291,"Aquisição de Serviços de Higiene e Limpeza, no âmbito do COVID-19, para os ACES Alto Ave; Alto Tâmega e Barroso; Aveiro/Norte; Barcelos/Esposende; Braga; Baixo/Tâmega; Douro Sul; Espinho/Gaia; Famalicão; Gaia; Gerês/Cabreira; Marão e Douro Norte; Porto Oriental; Póvoa de Varzim/Vila do Conde; Santo Tirso/Trofa e DICAD.","503135593 - Administração Regional de Saúde do Norte, I. P.","509418627 - Fine Facility Services, Lda.,",,Aquisição de serviços,Ajuste Direto Regime Geral,224000.0,129597.19,2022-03-28,2022-02-10,90910000-9 - Serviços de limpeza,Distrito não determinado,2022,1,60.0,alto,"[""ajuste direto"", ""valor elevado (224,000€)"", ""desvio preço 42%"", ""adjudicações repetidas (39x)""]",2022,2026-04-02T01:34:34.381242
330922,"Aquisição de Serviços de Comunicações Eletrónicas de Cloud E-mail, incluindo e-mail, calendário, contactos e tarefas",500051070 - Município de Lisboa,502604751 - NOS - Comunicações S.A.,,Aquisição de serviços,Ajuste Direto Regime Geral,498660.0,122839.73,2022-04-01,2022-03-31,64200000-8 - Serviços de telecomunicações,Lisboa,2022,1,60.0,alto,"[""ajuste direto"", ""valor elevado (498,660€)"", ""desvio preço 75%"", ""adjudicações repetidas (370x)""]",2022,2026-04-02T01:34:35.198199
331101,Hormona Libertadora Gonadotropina,"511228848 - Serviço de Saúde da Região Autónoma da Madeira, EPERAM (SESARAM, EPERAM)",502609800 - IPSEN PORTUGAL,,Aquisição de bens móveis,Ajuste Direto Regime Geral,161788.86,112008.82,2022-03-31,2022-02-08,33690000-3 - Medicamentos vários,Região Autónoma da Madeira,2022,1,60.0,alto,"[""ajuste direto"", ""valor elevado (161,789€)"", ""desvio preço 31%"", ""adjudicações repetidas (60x)""]",2022,2026-04-02T01:34:35.276482
331355,Aquisição de Serviços de Segurança e Vigilância Humana para suprir necessidades no âmbito do contexto epidemiológico da doença respiratória aguda por novo coronavírus (nCOV-2019) na DICAD; ACeS Alto Ave; ACeS Ave Famalicão; ACeS Douro Sul; ACeS Braga; ACeS Gaia; ACeS Porto Oriental; ACeS Porto Ocidental; ACeS Póvoa de Varzim/Vila do Conde.,"503135593 - Administração Regional de Saúde do Norte, I. P.","501326456 - Prestibel - Empresa de Segurança, S.A.",,Aquisição de serviços,Ajuste Direto Regime Geral,452003.3,193071.44,2022-04-04,2022-01-27,79714000-2 - Serviços de vigilância,Distrito não determinado,2022,1,60.0,alto,"[""ajuste direto"", ""valor elevado (452,003€)"", ""desvio preço 57%"", ""adjudicações repetidas (45x)""]",2022,2026-04-02T01:34:35.351716
331714,INIBIDORES DE TIROSINACINASES - EVEROLÍMUS,"511228848 - Serviço de Saúde da Região Autónoma da Madeira, EPERAM (SESARAM, EPERAM)","500063524 - NOVARTIS FARMA-PRODUT.FARMACEUTICOS, SA",,Aquisição de bens móveis,Ajuste Direto Regime Geral,117725.87,78251.67,2022-04-04,2022-02-21,33690000-3 - Medicamentos vários,Região Autónoma da Madeira,2022,1,60.0,alto,"[""ajuste direto"", ""valor elevado (117,726€)"", ""desvio preço 34%"", ""adjudicações repetidas (188x)""]",2022,2026-04-02T01:34:35.460997
331725,INIBIDORES DE TIROSINACINASES - SUNITINIB,"511228848 - Serviço de Saúde da Região Autónoma da Madeira, EPERAM (SESARAM, EPERAM)","500162166 - Laboratórios Pfizer, Lda",,Aquisição de bens móveis,Ajuste Direto Regime Geral,87794.47,51144.82,2022-04-04,2022-02-15,33690000-3 - Medicamentos vários,Região Autónoma da Madeira,2022,1,60.0,alto,"[""ajuste direto"", ""valor elevado (87,794€)"", ""desvio preço 42%"", ""adjudicações repetidas (245x)""]",2022,2026-04-02T01:34:35.463873
341389,040107342022 - PERÓXIDO DE HIDROGÉNIO ACELERADO 0.36% SOL SPRAY 750 ML,"510103448 - Centro Hospitalar e Universitário de Coimbra, E. P. E.","500086753 - Diversey Portugal-Sistemas de Higiene e Limpeza, Unipessoal, Lda",,Aquisição de bens móveis,Ajuste Direto Regime Geral,88000.0,50128.3,2022-05-12,2022-04-21,33600000-6 - Produtos farmacêuticos,Coimbra,2022,1,60.0,alto,"[""ajuste direto"", ""valor elevado (88,000€)"", ""desvio preço 43%"", ""adjudicações repetidas (23x)""]",2022,2026-04-02T01:34:37.865984
343190,"AD n.º 51/0016/2022 –  Fornecimento de Emtricitabina + Rilpivirina + Tenofovir, Emtricitabina + Rilpivirina + Tenofovir Alafenamida e Aztreonam ao Hospital de Santo Espírito da Ilha Terceira, EPER","512105030 - HOSPITAL DE SANTO ESPÍRITO DA ILHA TERCEIRA, EPER","503604704 - GILEAD SCIENCES, LDA",,Aquisição de bens móveis,Ajuste Direto Regime Geral,95248.08,35704.02,2022-05-18,2022-05-09,"33000000-0 - Equipamento médico, medicamentos e produtos para cuidados pessoais",Região Autónoma dos Açores,2022,1,60.0,alto,"[""ajuste direto"", ""valor elevado (95,248€)"", ""desvio preço 63%"", ""adjudicações repetidas (118x)""]",2022,2026-04-02T01:34:38.333828
343508,"EXCL SANOFI-PRODUTOS FARMACEUTICOS,LD - VÁRIOS","506361438 - Instituto Português de Oncologia de Coimbra Francisco Gentil, E. P. E.","500134960 - SANOFI- PRODUTOS FARMACÊUTICOS,LDA.",,Aquisição de bens móveis,Ajuste Direto Regime Geral,108272.8,22074.46,2022-05-24,2022-01-18,33600000-6 - Produtos farmacêuticos,Coimbra,2022,1,60.0,alto,"[""ajuste direto"", ""valor elevado (108,273€)"", ""desvio preço 80%"", ""adjudicações repetidas (920x)""]",2022,2026-04-02T01:34:38.405936
343915,"EXCL LABORATORIOS PFIZER LDA - TALAZOPARIB 1 MG, E 0,25 MG CAPS*","506361438 - Instituto Português de Oncologia de Coimbra Francisco Gentil, E. P. E.","500162166 - LAB. PFIZER, LDA.",,Aquisição de bens móveis,Ajuste Direto Regime Geral,78947.98,1314.47,2022-05-25,2022-01-11,33600000-6 - Produtos farmacêuticos,Coimbra,2022,1,60.0,alto,"[""ajuste direto"", ""valor elevado (78,948€)"", ""desvio preço 98%"", ""adjudicações repetidas (1676x)""]",2022,2026-04-02T01:34:38.507400
345191,"NP EXCL ASTRAZENECA-PRODUTOS FARMACEUTICOS, LDA - ACALABRUTINIB 100 MG","506361438 - Instituto Português de Oncologia de Coimbra Francisco Gentil, E. P. E.","502942240 - ASTRAZENECA-PRODUTOS FARMACÊUTICOS,LDA.",,Aquisição de bens móveis,Ajuste Direto Regime Geral,144781.5,14478.15,2022-05-25,2022-03-02,33600000-6 - Produtos farmacêuticos,Coimbra,2022,1,60.0,alto,"[""ajuste direto"", ""valor elevado (144,782€)"", ""desvio preço 90%"", ""adjudicações repetidas (737x)""]",2022,2026-04-02T01:34:38.781674
345725,EAD20220047 - ARTIGOS ESPECIFICOS PARA SUPORTE BASICO DE VIDA,"511228848 - Serviço de Saúde da Região Autónoma da Madeira, EPERAM (SESARAM, EPERAM)","506819698 - GETINGE GROUP PORTUGAL, UNIP LDA (MAQUET PORT)",,Aquisição de bens móveis,Ajuste Direto Regime Geral,100635.0,11235.5,2022-05-27,2022-04-07,33190000-8 - Dispositivos e produtos médicos variados,Região Autónoma da Madeira,2022,1,60.0,alto,"[""ajuste direto"", ""valor elevado (100,635€)"", ""desvio preço 89%"", ""adjudicações repetidas (36x)""]",2022,2026-04-02T01:34:38.896891
346358,"Fornecimento de Moroctocog alfa ao Hospital de Santo Espírito da Ilha Terceira, EPER","512105030 - Hospital de Santo Espírito da Ilha Terceira, E. P. E. R.","500162166 - LAB. PFIZER, LDA.",,Aquisição de bens móveis,Ajuste Direto Regime Geral,342600.88,235267.06,2022-05-31,2022-05-19,"33000000-0 - Equipamento médico, medicamentos e produtos para cuidados pessoais",Região Autónoma dos Açores,2022,1,60.0,alto,"[""ajuste direto"", ""valor elevado (342,601€)"", ""desvio preço 31%"", ""adjudicações repetidas (1676x)""]",2022,2026-04-02T01:34:39.012922
346547,Aquisição de serviços postais,"516160893 - Águas do Alto Alentejo, E. I. M., S. A.","500077568 - CTT - Correios de Portugal, SA",,Aquisição de serviços,Ajuste Direto Regime Geral,301980.0,194941.65,2022-06-03,2022-06-02,64110000-0 - Serviços postais,Portalegre,2022,1,60.0,alto,"[""ajuste direto"", ""valor elevado (301,980€)"", ""desvio preço 35%"", ""adjudicações repetidas (65x)""]",2022,2026-04-02T01:34:39.049807
348778,"Fornecimento de Metoxipolietilenoglicol – Epoetina beta e Epoetina beta ao Hospital de Santo Espírito da Ilha Terceira, EPER","512105030 - Hospital de Santo Espírito da Ilha Terceira, E. P. E. R.","500233810 - ROCHE FARMACÊUTICA QUIMICA, LDA.",,Aquisição de bens móveis,Ajuste Direto Regime Geral,200188.5,36671.0,2022-06-09,2022-05-31,"33000000-0 - Equipamento médico, medicamentos e produtos para cuidados pessoais",Região Autónoma dos Açores,2022,1,60.0,alto,"[""ajuste direto"", ""valor elevado (200,188€)"", ""desvio preço 82%"", ""adjudicações repetidas (1057x)""]",2022,2026-04-02T01:34:39.496106
350340,"Fornecimento de Panitumumab ao Hospital de Santo Espírito da Ilha Terceira, EPER","512105030 - HOSPITAL DE SANTO ESPÍRITO DA ILHA TERCEIRA, EPER","512063605 - Luís Peixoto, Lda",,Aquisição de bens móveis,Ajuste Direto Regime Geral,83339.16,6125.0,2022-06-23,2022-06-13,"33000000-0 - Equipamento médico, medicamentos e produtos para cuidados pessoais",Região Autónoma dos Açores,2022,1,60.0,alto,"[""ajuste direto"", ""valor elevado (83,339€)"", ""desvio preço 93%"", ""adjudicações repetidas (39x)""]",2022,2026-04-02T01:34:40.258550
352089,Manutenção e reparação de equipamento da marca Palfinger,"509680780 - Ambiolhão - Empresa Municipal de Ambiente de Olhão, EM",507208013 - PALFINGER- COMERCIO E ALUGUER DE MÁQUINAS SA,,Aquisição de serviços,Ajuste Direto Regime Geral,80000.0,54149.92,2022-07-01,2022-07-01,"50100000-6 - Serviços de reparação e manutenção de veículos e equipamento afim, e serviços conexos",Faro,2022,1,60.0,alto,"[""ajuste direto"", ""valor elevado (80,000€)"", ""desvio preço 32%"", ""adjudicações repetidas (31x)""]",2022,2026-04-02T01:34:40.776974
354816,"Fornecimento de Secucinumab, Ribociclib, Nilotinib, Omalizumab e Everolimus ao HSEIT, EPER","512105030 - HOSPITAL DE SANTO ESPÍRITO DA ILHA TERCEIRA, EPER","500063524 - NOVARTIS FARMA-PROD.FARMACÊUTICOS,SA.",,Aquisição de bens móveis,Ajuste Direto Regime Geral,310315.57,134484.34,2022-07-14,2022-07-01,"33000000-0 - Equipamento médico, medicamentos e produtos para cuidados pessoais",Região Autónoma dos Açores,2022,1,60.0,alto,"[""ajuste direto"", ""valor elevado (310,316€)"", ""desvio preço 57%"", ""adjudicações repetidas (908x)""]",2022,2026-04-02T01:34:41.453405
355793,"AD n.º 51/0012/2022 –  Fornecimento de Nintedanib e Tenecteplase ao Hospital de Santo Espírito da Ilha Terceira, EPER","512105030 - Hospital de Santo Espírito da Ilha Terceira, E. P. E. R.",500293023 - UNILFARMA,,Aquisição de bens móveis,Ajuste Direto Regime Geral,81883.08,34729.02,2022-07-19,2022-05-11,"33000000-0 - Equipamento médico, medicamentos e produtos para cuidados pessoais",Região Autónoma dos Açores,2022,1,60.0,alto,"[""ajuste direto"", ""valor elevado (81,883€)"", ""desvio preço 58%"", ""adjudicações repetidas (15x)""]",2022,2026-04-02T01:34:41.643567
356219,"Fornecimento de Trastuzumab 600 mg e Trastuzumab Emtansina ao HSEIT, EPER","512105030 - HOSPITAL DE SANTO ESPÍRITO DA ILHA TERCEIRA, EPER","500233810 - ROCHE FARMACÊUTICA QUIMICA, LDA.",,Aquisição de bens móveis,Ajuste Direto Regime Geral,347010.16,235606.82,2022-07-21,2022-07-04,"33000000-0 - Equipamento médico, medicamentos e produtos para cuidados pessoais",Região Autónoma dos Açores,2022,1,60.0,alto,"[""ajuste direto"", ""valor elevado (347,010€)"", ""desvio preço 32%"", ""adjudicações repetidas (1057x)""]",2022,2026-04-02T01:34:41.723597
359454,EXCL SERVIER PORTUGAL - TRIFLURIDINA+TIPIRACILO,"506361438 - Instituto Português de Oncologia de Coimbra Francisco Gentil, E. P. E.",502177420 - SERVIER PORTUGAL - ESPECIALIDADES FARMACEUTICAS,,Aquisição de bens móveis,Ajuste Direto Regime Geral,111375.0,148500.0,2022-07-28,2022-07-18,33600000-6 - Produtos farmacêuticos,Coimbra,2022,1,60.0,alto,"[""ajuste direto"", ""valor elevado (111,375€)"", ""desvio preço 33%"", ""adjudicações repetidas (129x)""]",2022,2026-04-02T01:34:42.318616
361635,Aquisição de Serviços de Transporte de Passageiros,500122237 - Fundação INATEL,"500269165 - Resende Actividades Turisticas, SA",,Aquisição de serviços,Ajuste Direto Regime Geral,215512.6,88428.25,2022-08-09,2022-08-08,60172000-4 - Aluguer de autocarros e autocarros de turismo com condutor,,2022,1,60.0,alto,"[""ajuste direto"", ""valor elevado (215,513€)"", ""desvio preço 59%"", ""adjudicações repetidas (11x)""]",2022,2026-04-02T01:34:43.359009
364512,"Aquisição espuma de poliuretano com surfactante F68, não adesiva 17X19 cm","508094461 - Unidade Local de Saúde do Norte Alentejano, E. P. E.",501886621 - EXPOMEDICA,,Aquisição de bens móveis,Ajuste Direto Regime Geral,105000.0,29400.0,2022-08-24,2022-08-17,"33000000-0 - Equipamento médico, medicamentos e produtos para cuidados pessoais",Portalegre,2022,1,60.0,alto,"[""ajuste direto"", ""valor elevado (105,000€)"", ""desvio preço 72%"", ""adjudicações repetidas (88x)""]",2022,2026-04-02T01:34:44.065579
365833,Aquisição de serviços de gestão da operação da Linha Segurança Social e Linha Nacional de Emergência Social -,"505305500 - Instituto da Segurança Social, I. P.","504615947 - MEO-Serviços de Comunicações e Multimédia, SA",,Aquisição de serviços,Ajuste Direto Regime Geral,349564.86,202872.66,2022-09-01,2022-08-31,79510000-2 - Serviços de atendimento de telefones,Castelo Branco,2022,1,60.0,alto,"[""ajuste direto"", ""valor elevado (349,565€)"", ""desvio preço 42%"", ""adjudicações repetidas (29x)""]",2022,2026-04-02T01:34:44.341020
368428,"Aquisição de serviços de “Conta Pré-Paga Escolar"".",502177080 - Município de Mafra,"505231212 - PayShop (Portugal), S.A",,Aquisição de serviços,Ajuste Direto Regime Geral,97561.02,45793.0,2022-09-19,2022-09-19,98390000-3 - Outros serviços,Lisboa,2022,1,60.0,alto,"[""ajuste direto"", ""valor elevado (97,561€)"", ""desvio preço 53%"", ""adjudicações repetidas (90x)""]",2022,2026-04-02T01:34:44.829701
373815,"Aquisição de Serviços de formação, no âmbito da Pós-Graduação em Emergência Médica e Catástrofe",506971244 - Instituto Politécnico de Leiria,"512106088 - Blue Ocean Medical, Lda.",,Aquisição de serviços,Ajuste Direto Regime Geral,162000.0,91560.0,2022-10-11,2022-10-07,80520000-5 - Instalações para formação,Leiria,2022,1,60.0,alto,"[""ajuste direto"", ""valor elevado (162,000€)"", ""desvio preço 43%"", ""adjudicações repetidas (14x)""]",2022,2026-04-02T01:34:46.501806
376407,Aquisição de serviço em regime de cartões de refeição,500051054 - Município de Almada,"501465804 - EDENRED PORTUGAL, S.A.",,Aquisição de serviços,Ajuste Direto Regime Geral,126296.34,80816.5,2022-10-19,2022-10-19,55100000-1 - Serviços de hotelaria,Setúbal,2022,1,60.0,alto,"[""ajuste direto"", ""valor elevado (126,296€)"", ""desvio preço 36%"", ""adjudicações repetidas (38x)""]",2022,2026-04-02T01:34:47.038706
382394,62/3335/2022-Aquisição de material Cirurgia da catarata,"510745997 - Centro Hospitalar Universitário do Algarve, E.P.E.",501251685 - Alcon Portugal,,Aquisição de bens móveis,Ajuste Direto Regime Geral,85956.0,176684.0,2022-11-16,2022-07-28,33140000-3 - Material médico de consumo,Faro,2022,1,60.0,alto,"[""ajuste direto"", ""valor elevado (85,956€)"", ""desvio preço 106%"", ""adjudicações repetidas (67x)""]",2022,2026-04-02T01:34:48.935820
383233,"PRESTAÇÃO DE SERVIÇOS DE TRANSPORTE DE EMERGÊNCIA SOCIAL PARA O ISS, I.P.","505305500 - Instituto da Segurança Social, I. P.",500745749 - Cruz Vermelha Portuguesa,,Aquisição de serviços,Ajuste Direto Regime Geral,152256.91,105935.18,2022-11-25,2022-11-22,85143000-3 - Serviços de ambulâncias,,2022,1,60.0,alto,"[""ajuste direto"", ""valor elevado (152,257€)"", ""desvio preço 30%"", ""adjudicações repetidas (186x)""]",2022,2026-04-02T01:34:49.132600
383717,"AM 414/2022 - AM/414/2022 – Prestação de Serviços Médicos nos ACES, 01 de outubro a 13 de nov., ao abrigo da alínea c) do n. º1 do art.º 24 do CCP - (Aquisição no âmbito do DL n. º10-A/2020) – COVID 19","503148709 - Administração Regional de Saúde do Algarve, I. P.","510723691 - Kelly Services Healthcare, Unipessoal, Lda",,Aquisição de serviços,Ajuste Direto Regime Geral,123274.95,70748.36,2022-11-28,2022-10-04,85120000-6 - Serviços de prática médica e serviços conexos,Faro,2022,1,60.0,alto,"[""ajuste direto"", ""valor elevado (123,275€)"", ""desvio preço 43%"", ""adjudicações repetidas (16x)""]",2022,2026-04-02T01:34:49.313711
384764,040131972022 - POLATUZUMAB VEDOTINA 140 MG PÓ CONC SOL INJ FR IV,"510103448 - Centro Hospitalar e Universitário de Coimbra, E.P.","500233810 - Roche Farmacêutica Química, Lda",,Aquisição de bens móveis,Ajuste Direto Regime Geral,116463.96,29115.99,2022-11-28,2022-11-21,33600000-6 - Produtos farmacêuticos,Coimbra,2022,1,60.0,alto,"[""ajuste direto"", ""valor elevado (116,464€)"", ""desvio preço 75%"", ""adjudicações repetidas (24x)""]",2022,2026-04-02T01:34:49.571016
386629,Contratação de Serviços de Policiamento no CHUPorto,"508331471 - Centro Hospitalar Universitário do Porto, E. P. E.",600006662 - Polícia de Segurança Pública,,Aquisição de serviços,Ajuste Direto Regime Geral,130166.08,173648.19,2022-12-13,2022-11-30,98300000-6 - Serviços diversos,Porto,2022,1,60.0,alto,"[""ajuste direto"", ""valor elevado (130,166€)"", ""desvio preço 33%"", ""adjudicações repetidas (91x)""]",2022,2026-04-02T01:34:49.922763
391713,AQUISIÇÃO DE SERVIÇOS DE TRANSPORTE PARA ALUNOS COM NECESSIDADES EDUCATIVAS ESPECIAIS (NEE) PARA O ANO LETIVO 2022/2023 - AE ÁGUAS SANTAS E AE DR. VIEIRA DE CARVALHO,505387131 - Município da Maia,501048090 - ASSOCIAÇAO HUMANITARIA DOS BOMBEIROS VOLUNTARIOS DE MOREIRA DA MAIA,,Aquisição de serviços,Ajuste Direto Regime Geral,177500.0,88223.33,2022-12-23,2022-12-09,60130000-8 - Serviços de transporte rodoviário de passageiros com finalidade específica,Porto,2022,1,60.0,alto,"[""ajuste direto"", ""valor elevado (177,500€)"", ""desvio preço 50%"", ""adjudicações repetidas (11x)""]",2022,2026-04-02T01:34:51.534118
417399,"01/AD/ECO/2025 - Ajuste Direto por critérios materiais para o ""Fornecimento de Energia Elétrica (MT e BTE)"".","504871650 - Ecolezíria - Empresa Intermunicipal para o Tratamento de Resíduos Sólidos, E. I. M.","980245974 - Endesa Energia, S.A. - Sucursal Portugal",,Aquisição de bens móveis,Ajuste Direto Regime Geral,90000.0,11503.78,2025-02-06,2025-02-05,09310000-5 - Electricidade,Santarém,2025,1,60.0,alto,"[""ajuste direto"", ""valor elevado (90,000€)"", ""desvio preço 87%"", ""adjudicações repetidas (105x)""]",2025,2026-04-02T01:34:58.075539
418479,AP 2_Aquisição de serviço de Higiene e Limpeza,"501427511 - Instituto Nacional de Saúde Doutor Ricardo Jorge, I. P.","517640112 - TMLJ - FACILITY SERVICES, UNIPESSOAL LDA",,Aquisição de serviços,Ajuste Direto Regime Geral,172120.22,55019.42,2025-02-11,2025-02-07,90910000-9 - Serviços de limpeza,Porto,2025,1,60.0,alto,"[""ajuste direto"", ""valor elevado (172,120€)"", ""desvio preço 68%"", ""adjudicações repetidas (139x)""]",2025,2026-04-02T01:34:58.269996
424169,Fornecimento de Gás Natural Canalizado para o Complexo das Piscinas Municipais de Olhão,506321894 - Município de Olhão,"500697370 - PETROGAL, S.A.",,Aquisição de bens móveis,Ajuste Direto Regime Geral,90000.0,37121.78,2025-02-19,2025-02-18,09120000-6 - Combustíveis gasosos,Faro,2025,1,60.0,alto,"[""ajuste direto"", ""valor elevado (90,000€)"", ""desvio preço 59%"", ""adjudicações repetidas (513x)""]",2025,2026-04-02T01:35:00.107394
429194,RFN - MANUTENÇÃO TELEMÁTICA 1ª LINHA LOTE 1 CT5,"503933813 - Infraestruturas de Portugal, S. A.","502533447 - Efacec Engenharia e Sistemas, S.A.",,Aquisição de serviços,Ajuste Direto Regime Geral,160885.34,234809.42,2025-02-27,2025-02-25,50225000-8 - Serviços de manutenção de vias férreas,,2025,1,60.0,alto,"[""ajuste direto"", ""valor elevado (160,885€)"", ""desvio preço 46%"", ""adjudicações repetidas (27x)""]",2025,2026-04-02T01:35:01.140291
446239,Ajuste direto para aquisição de vacina polissacárida conjugada contra a doença pneumocócica de 20 valências,508094461 - Unidade Local de Saúde do Alto Alentejo E.P.E,"500162166 - LAB. PFIZER, LDA.",,Aquisição de bens móveis,Ajuste Direto Regime Geral,91200.0,59508.0,2025-04-07,2025-04-01,33600000-6 - Produtos farmacêuticos,Portalegre,2025,1,60.0,alto,"[""ajuste direto"", ""valor elevado (91,200€)"", ""desvio preço 35%"", ""adjudicações repetidas (1676x)""]",2025,2026-04-02T01:35:06.029782
455746,RRN-MANUTENÇÃO TELEMÁTICA RODO CT3,503933813 - Infraestruturas de Portugal,"501369295 - CME - Construção e Manutenção Electromecânicas, S.A.",,Aquisição de serviços,Ajuste Direto Regime Geral,113509.0,168961.0,2025-04-23,2025-04-11,50230000-6 - Serviços de reparação e manutenção e serviços conexos relacionados com estradas e outros equipamentos,,2025,1,60.0,alto,"[""ajuste direto"", ""valor elevado (113,509€)"", ""desvio preço 49%"", ""adjudicações repetidas (21x)""]",2025,2026-04-02T01:35:08.846497
468900,Ajuste direto para aquisição de T1821 - TEPOTINIB [225 MG; CÁP/COMP],"509186998 - Unidade Local de Saúde do Arco Ribeirinho, E.P.E.",500650870 - MERCK SA,,Aquisição de bens móveis,Ajuste Direto Regime Geral,204815.95,68271.98,2025-05-19,2025-03-20,33600000-6 - Produtos farmacêuticos,Setúbal,2025,1,60.0,alto,"[""ajuste direto"", ""valor elevado (204,816€)"", ""desvio preço 67%"", ""adjudicações repetidas (153x)""]",2025,2026-04-02T01:35:12.421850
475651,L. SUL E L. SINES - CANAL CAVEIRA-SINES - ACOMPANHAMENTO AOS TRABALHOS DE MODERNIZAÇÃO,"503933813 - Infraestruturas de Portugal, S. A.","514750901 - Siemens Mobility, Unipessoal Lda",,Aquisição de serviços,Ajuste Direto Regime Geral,150000.0,14578.0,2025-04-30,2025-04-22,50220000-3 - Serviços de reparação e manutenção e serviços conexos relacionados com vias férreas e outro equipamento,Setúbal,2025,1,60.0,alto,"[""ajuste direto"", ""valor elevado (150,000€)"", ""desvio preço 90%"", ""adjudicações repetidas (28x)""]",2025,2026-04-02T01:35:14.672843
483067,Ajuste direto para aquisição de C23175 - CEMIPLIMAB [50 MG/ML; 7 ML; SOL INJ; FRS],508094461 - Unidade Local de Saúde do Alto Alentejo E.P.E,"503934640 - ALLOGA LOGIFARMA, SA",,Aquisição de bens móveis,Ajuste Direto Regime Geral,255144.49,173226.04,2025-06-04,2025-04-17,33600000-6 - Produtos farmacêuticos,"Portalegre
Portugal",2025,1,60.0,alto,"[""ajuste direto"", ""valor elevado (255,144€)"", ""desvio preço 32%"", ""adjudicações repetidas (1258x)""]",2025,2026-04-02T01:35:17.014060
